{
  "$schema": "http://json-schema.org/draft-07/schema#",
  "type": "object",
  "required": [
    "lcAmount","lcType","lcApplicant","currency","beneficiary","issuingBank","issuanceDate","expirationDate"
  ],
  "additionalProperties": false,
  "properties": {
    "lcNumber": {
      "type": "string"
    },
    "lcType": {
      "type": "string"
    },
    "lcApplicant": {
      "type": "string"
    },
    "lcAmount": {
      "type": "string"
    },
    "currency": {
      "type": "string"
    },
    "beneficiary": {
      "type": "string"
    },
    "issuingBank": {
      "type": "string"
    },
    "issuanceDate": {
      "type": "string"
    },
    "expirationDate": {
      "type": "string"
    },
    "terms": {
      "type": "array"
    }
  }
}